{
	"$schema": "https://json-schema.org/draft-07/schema",
	"$id": "Teal-Owl_Backend/product.schema.json/v1.0",
	"title": "Teal-Owl_manifest",
	"description": "A manifest generated by Teal-Owl published and consumed by Teal-Owl reader",
	"type": "object",
	"properties": {
		"version": {
			"description": "The version of the manifest",
			"type": "string"
		},
		"author": {
			"description": "The author of the manifest",
			"type": "string"
		},
		"document": {
			"description": "The document the manifest is for",
			"type": "string"
		},
		"timestamp": {
			"description": "The timestamp of the manifest",
			"type": "string",
			"format": "date-time"
		},
		"hashList": {
			"description": "The list of hashes of each paragraph of the document",
			"type": "array",
			"items": {
				"type": "string"
			},
			"minItems": 1
		},
		"notes": {
			"description": "The notes the author added before pubblication",
			"type": "string"
		}
	},
	"required": [
		"version",
		"author",
		"document",
		"timestamp",
		"hashList"
	]
}