{"version":"1.0","author":"alessandro.benetton@studio.unibo.it","document":"1JUhzMh3RAOVqns21JaIAWl-hD3Isz869YmbGb15pAH8","hashList":["7ea35a73c3b4d7616696eb7d5bd416fd63430d62a4de2f9c004e050ae289b257","21a4444e568f53c4ab20aaa6f541b3d40f48f70a70eb6601b757544148f7a504","af9d8adb7a69ccc758c1eb30e59bef7bcbb7e894f3452c2eeb5e34078ed0f479"],"timestamp":"2023-12-06T10:16:58.464Z"}