{
	"version": "1.0",
	"author": "alessandro.benetton@studio.unibo.it",
	"document": "1JUhzMh3RAOVqns21JaIAWl-hD3Isz869YmbGb15pAH8",
	"hashList": [
		"316a8a13bc03f99edf8de0e024a7a69e3ddfcee8f8eb8745b0a809ddd58f9928",
		"af9d8adb7a69ccc758c1eb30e59bef7bcbb7e894f3452c2eeb5e34078ed0f479"
	],
	"timestamp": "2023-12-12T15:52:22.835Z"
}